{
  "$schema": "http://json-schema.org/draft-07/schema#",
  "$id": "https://raw.githubusercontent.com/jsonresume/jsonresume.org/master/packages/schema/resume.schema.json",
  "title": "JSON Resume Schema (TalentScout Extended)",
  "type": "object",
  "additionalProperties": false,
  "properties": {
    "basics": {
      "type": "object",
      "additionalProperties": false,
      "required": ["name", "email"],
      "properties": {
        "name": { "type": "string" },
        "label": { "type": "string" },
        "image": { "type": "string" },
        "email": { "type": "string", "format": "email" },
        "phone": { "type": "string" },
        "url": { "type": "string", "format": "uri" },
        "summary": { "type": "string" },
        "location": {
          "type": "object",
          "additionalProperties": false,
          "properties": {
            "address": { "type": "string" },
            "postalCode": { "type": "string" },
            "city": { "type": "string" },
            "countryCode": { "type": "string" },
            "region": { "type": "string" }
          }
        },
        "profiles": {
          "type": "array",
          "items": {
            "type": "object",
            "additionalProperties": false,
            "required": ["network", "username"],
            "properties": {
              "network": { "type": "string" },
              "username": { "type": "string" },
              "url": { "type": "string", "format": "uri" }
            }
          }
        }
      }
    },
    "work": {
      "type": "array",
      "items": {
        "type": "object",
        "additionalProperties": false,
        "required": ["name", "position", "startDate"],
        "properties": {
          "name": { "type": "string" },
          "position": { "type": "string" },
          "url": { "type": "string", "format": "uri" },
          "startDate": { "type": "string" },
          "endDate": { "type": "string" },
          "summary": { "type": "string" },
          "highlights": {
            "type": "array",
            "items": { "type": "string" }
          },
          "tags": {
            "type": "array",
            "items": { "type": "string" }
          },
          "location": { "type": "string" },
          "keyResponsibilities": {
            "type": "array",
            "items": { "type": "string" }
          },
          "skillsUsed": {
            "type": "array",
            "items": { "type": "string" }
          },
          "toolsUsed": {
            "type": "array",
            "items": { "type": "string" }
          },
          "challenges": {
            "type": "array",
            "items": { "type": "string" }
          },
          "wins": {
            "type": "array",
            "items": { "type": "string" }
          },
          "lessonsLearned": {
            "type": "array",
            "items": { "type": "string" }
          },
          "atsBullets": {
            "type": "object",
            "additionalProperties": false,
            "properties": {
              "CAR": { "type": "array", "items": { "type": "string" } },
              "STAR": { "type": "array", "items": { "type": "string" } },
              "LPS": { "type": "array", "items": { "type": "string" } },
              "ELITE": { "type": "array", "items": { "type": "string" } },
              "WHO": { "type": "array", "items": { "type": "string" } }
            }
          }
        }
      }
    },
    "volunteer": {
      "type": "array",
      "items": {
        "type": "object",
        "additionalProperties": false,
        "required": ["organization", "position"],
        "properties": {
          "organization": { "type": "string" },
          "position": { "type": "string" },
          "url": { "type": "string", "format": "uri" },
          "startDate": { "type": "string" },
          "endDate": { "type": "string" },
          "summary": { "type": "string" },
          "highlights": {
            "type": "array",
            "items": { "type": "string" }
          }
        }
      }
    },
    "education": {
      "type": "array",
      "items": {
        "type": "object",
        "additionalProperties": false,
        "required": ["institution", "area", "studyType"],
        "properties": {
          "institution": { "type": "string" },
          "url": { "type": "string", "format": "uri" },
          "area": { "type": "string" },
          "studyType": { "type": "string" },
          "startDate": { "type": "string" },
          "endDate": { "type": "string" },
          "score": { "type": "string" },
          "courses": {
            "type": "array",
            "items": { "type": "string" }
          }
        }
      }
    },
    "awards": {
      "type": "array",
      "items": {
        "type": "object",
        "additionalProperties": false,
        "required": ["title", "awarder"],
        "properties": {
          "title": { "type": "string" },
          "date": { "type": "string" },
          "awarder": { "type": "string" },
          "summary": { "type": "string" }
        }
      }
    },
    "certificates": {
      "type": "array",
      "items": {
        "type": "object",
        "additionalProperties": false,
        "required": ["name", "issuer"],
        "properties": {
          "name": { "type": "string" },
          "date": { "type": "string" },
          "issuer": { "type": "string" },
          "url": { "type": "string", "format": "uri" }
        }
      }
    },
    "publications": {
      "type": "array",
      "items": {
        "type": "object",
        "additionalProperties": false,
        "required": ["name", "publisher"],
        "properties": {
          "name": { "type": "string" },
          "publisher": { "type": "string" },
          "releaseDate": { "type": "string" },
          "url": { "type": "string", "format": "uri" },
          "summary": { "type": "string" }
        }
      }
    },
    "skills": {
      "type": "array",
      "items": {
        "type": "object",
        "additionalProperties": false,
        "required": ["name"],
        "properties": {
          "name": { "type": "string" },
          "level": { "type": "string" },
          "keywords": {
            "type": "array",
            "items": { "type": "string" }
          },
          "tags": {
            "type": "array",
            "items": { "type": "string" }
          }
        }
      }
    },
    "languages": {
      "type": "array",
      "items": {
        "type": "object",
        "additionalProperties": false,
        "required": ["language", "fluency"],
        "properties": {
          "language": { "type": "string" },
          "fluency": { "type": "string" }
        }
      }
    },
    "interests": {
      "type": "array",
      "items": {
        "type": "object",
        "additionalProperties": false,
        "required": ["name"],
        "properties": {
          "name": { "type": "string" },
          "keywords": {
            "type": "array",
            "items": { "type": "string" }
          }
        }
      }
    },
    "references": {
      "type": "array",
      "items": {
        "type": "object",
        "additionalProperties": false,
        "required": ["name", "reference"],
        "properties": {
          "name": { "type": "string" },
          "reference": { "type": "string" }
        }
      }
    },
    "projects": {
      "type": "array",
      "items": {
        "type": "object",
        "additionalProperties": false,
        "required": ["name", "description"],
        "properties": {
          "name": { "type": "string" },
          "description": { "type": "string" },
          "highlights": {
            "type": "array",
            "items": { "type": "string" }
          },
          "keywords": {
            "type": "array",
            "items": { "type": "string" }
          },
          "startDate": { "type": "string" },
          "endDate": { "type": "string" },
          "url": { "type": "string", "format": "uri" },
          "roles": {
            "type": "array",
            "items": { "type": "string" }
          },
          "entity": { "type": "string" },
          "type": { "type": "string" },
          "tags": {
            "type": "array",
            "items": { "type": "string" }
          }
        }
      }
    }
  }
}
