{
  "basics": {
    "name": "Thomas S. Snyder",
    "label": "Senior QA Engineer — Test Automation & AI-Assisted Development",
    "image": "",
    "email": "Mr.Thomas.Snyder@gmail.com",
    "phone": "please email",
    "url": "https://www.linkedin.com/in/mr-thomas-snyder/",
    "summary": "Senior Software Test Engineer with 25+ years across Microsoft, Smartsheet, OpenMarket, and mobile/console game ecosystems. Builds automation from scratch, elevates QA practices across organizations, and reduces time-to-release through tight feedback loops with stakeholders. Integrates AI tooling — including custom MCP-based agents — into testing and development workflows.",
    "location": {
      "address": "17325 NE 85th PL Apt C-105",
      "postalCode": "98052",
      "city": "Redmond",
      "countryCode": "US",
      "region": "Washington"
    },
    "profiles": [
      {
        "network": "LinkedIn",
        "username": "mr-thomas-snyder",
        "url": "https://www.linkedin.com/in/mr-thomas-snyder/"
      },
      {
        "network": "GitHub",
        "username": "Mr-Thomas-Snyder",
        "url": "https://github.com/Mr-Thomas-Snyder?tab=repositories"
      },
      {
        "network": "GitHub",
        "username": "Saikojin",
        "url": "https://github.com/Saikojin/seikoclaw-harness"
      }
    ]
  },
  "work": [
    {
      "name": "Smartsheet",
      "position": "Senior QA Engineer",
      "url": "https://www.smartsheet.com",
      "startDate": "2021-11-01",
      "endDate": "2025-12-01",
      "summary": "Software Test Engineer focused on manual and automated testing of a Drupal-based website and multiple custom applications. Built Karate-based automation suite from nothing; championed automation expansion to free up engineering capacity for exploratory testing.",
      "highlights": [
        "Built new automation suites covering 85% of all manual testing with 1,500 tests — from zero automation baseline",
        "Maintained and expanded automation reporting for stakeholders",
        "Used Browserstack for cross-browser and mobile testing",
        "Managed test execution, triage, bug management, and resolution",
        "Tracked lifecycle timelines and produced test status reports"
      ],
      "tags": ["automation", "karate", "drupal", "web", "qa"]
    },
    {
      "name": "OpenMarket",
      "position": "Senior QA Engineer",
      "url": "https://www.openmarket.com",
      "startDate": "2019-01-01",
      "endDate": "2021-06-01",
      "summary": "Software Test Engineer testing web services and APIs managing SMS, MMS, and RCS traffic. Maintained legacy Fitness automation, coded new tests in Karate, and transitioned to cloud technology team testing AWS-refactored services. Principal advocate for company-wide QA standardization.",
      "highlights": [
        "Built documentation stores for test tools and methods, standardizing QA practices across the organization",
        "Configured hardware and software environments for manual and automated test execution",
        "Automated tests in both Fit and Karate frameworks",
        "Tracked lifecycle timelines and produced test status reports"
      ],
      "tags": ["automation", "api", "karate", "aws", "sms", "qa"]
    },
    {
      "name": "Apptio",
      "position": "Senior QA Engineer",
      "url": "https://www.apptio.com",
      "startDate": "2018-04-01",
      "endDate": "2018-12-01",
      "summary": "Software Test Engineer focused on manual testing of an IT financial management web application. Principal tester for Fortune 500 client upgrade validations — stood up instances, ran automation, administered test users.",
      "highlights": [
        "Set up and deployed client environment instances for upgrade testing",
        "Built product knowledge base and upcoming feature documentation",
        "Pushed management to broaden automation capabilities",
        "Standardized documentation and experience sharing across disciplines"
      ],
      "tags": ["manual-testing", "enterprise", "web", "qa"]
    },
    {
      "name": "Placed Inc.",
      "position": "Software Test Engineer",
      "url": "https://www.placed.com",
      "startDate": "2015-11-01",
      "endDate": "2018-01-01",
      "summary": "Key engineer in building the Quality Assurance department. Established baseline processes and documentation for new hires. Ran daily, weekly, and monthly test cycles for aggressive web releases and quarterly mobile releases.",
      "highlights": [
        "Built QA department baseline processes and new-hire documentation",
        "Drove cross-team knowledge sharing through presentations and documentation",
        "Lead meetings and product development discussions to uphold quality standards",
        "Ran daily, weekly, monthly test cycles for web and quarterly cycles for mobile"
      ],
      "tags": ["mobile", "web", "manual-testing", "qa", "process"]
    },
    {
      "name": "Array Health",
      "position": "Software Test Engineer",
      "url": "https://www.arrayhealth.com",
      "startDate": "2014-11-01",
      "endDate": "2015-10-01",
      "summary": "Key engineer in developing the QA department for a healthcare web application. Established processes, created ramp-up documents for new hires, and promoted cross-team knowledge sharing.",
      "highlights": [
        "Developed QA baseline processes and new-hire ramp-up documentation",
        "Led meetings and product development discussions to enforce quality standards",
        "Standardized documentation and experience sharing across disciplines"
      ],
      "tags": ["web", "healthcare", "manual-testing", "qa"]
    },
    {
      "name": "Microsoft",
      "position": "Software Test Engineer 3 — Device & App Compatibility (Windows OS)",
      "url": "https://www.microsoft.com",
      "startDate": "2011-07-01",
      "endDate": "2014-09-01",
      "summary": "Subject matter expert in device and application compatibility for Windows OS. Performed weekly manual and automated build tests, developed new tests and tools as new hardware platforms were absorbed, and documented and trained testers to handle increased workloads.",
      "highlights": [
        "Created modular testing methodology enabling rapid ramp-up of new testers across 15+ feature areas",
        "Standardized testing processes across feature teams using shared documentation",
        "Developed tools to automate new feature area testing as hardware platforms were added",
        "Trained new and existing testers on tools, hardware, and processes"
      ],
      "tags": ["windows", "compatibility", "automation", "microsoft", "qa"]
    },
    {
      "name": "Microsoft",
      "position": "Software Test Engineer 3 — Mobile Applications",
      "url": "https://www.microsoft.com",
      "startDate": "2010-11-01",
      "endDate": "2011-04-01",
      "summary": "Principal Test Engineer for mobile applications on multiple handset devices. Drove creation of test plans and cases; developed scenario-based tests for offshore team handoff after project completion.",
      "highlights": [
        "Created the group's first scenario-based tests — enabling untrained testers to deliver professional results",
        "Provided UI and feature feedback resulting in product stability and multi-region language improvements",
        "Documented software defects across multiple bug tracking systems",
        "Developed transition documentation for offshore team handoff"
      ],
      "tags": ["mobile", "microsoft", "scenario-testing", "qa"]
    },
    {
      "name": "Hewlett-Packard",
      "position": "Software & Hardware QA Engineer",
      "url": "https://www.hp.com",
      "startDate": "2009-01-01",
      "endDate": "2010-09-01",
      "summary": "QA engineer responsible for triage training and group reorganization. Collaborated with internal and external teams to reorganize support labs, utilized in-house tools to automate manual processes, and built machine imaging infrastructure.",
      "highlights": [
        "Reorganized consumer and enterprise support labs to improve workflow efficiency",
        "Built machine imaging infrastructure reducing machine recovery time",
        "Investigated external and internal hardware bugs and configured reproduction scenarios",
        "Researched and implemented process improvements for the department"
      ],
      "tags": ["hardware", "triage", "infrastructure", "hp", "qa"]
    },
    {
      "name": "Medio Systems",
      "position": "Software Test Engineer 3",
      "url": "https://www.mediosystems.com",
      "startDate": "2008-08-01",
      "endDate": "2008-11-01",
      "summary": "QA engineer testing ad delivery and data collection from phones. Performed plan-based and ad-hoc testing on local and remote devices to ensure delivery of ad, media, and subscription content, and validated data ingestion for analytics.",
      "highlights": [
        "Created scenario-based tests enabling untrained testers to deliver actionable results",
        "Validated key data ingestion paths for analytics",
        "Collaborated with SDET team to develop API testing tools",
        "Supported late-night deployments to live wireless devices"
      ],
      "tags": ["mobile", "api", "ad-tech", "qa"]
    },
    {
      "name": "Microsoft",
      "position": "Software Test Engineer 3 — Mobile Lync (Nokia)",
      "url": "https://www.microsoft.com",
      "startDate": "2007-11-01",
      "endDate": "2008-06-01",
      "summary": "Principal Test Engineer for the Mobile Lync application on Nokia handsets under Microsoft-Nokia partnership. Drove test plan creation and developed scenario-based tests for offshore team handoff.",
      "highlights": [
        "Created the first scenario-based tests for the Nokia partnership enabling offshore team transfer",
        "Managed remote offshore team progress and reporting",